id,case_name,court,decision_date,case_number,category,issues,summary,text,source_url
SYN-101,교차로 추돌 사고 사건,교육용 합성법원,2026-05-06,합성2026민사101,교통,신호 위반과 과실 비율,블랙박스 영상과 신호 체계를 기준으로 과실 비율을 정한 사례,교차로에서 좌회전 차량과 직진 차량이 충돌한 사안. 이 사건의 핵심 쟁점은 신호 위반과 과실 비율이다. 법원은 관련 자료와 당사자 진술을 종합하여 블랙박스 영상과 신호 체계를 기준으로 과실 비율을 정한 사례,
SYN-102,보행자 사고 손해배상 사건,교육용 합성법원,2024-06-13,합성2024민사102,교통,횡단보도 사고와 운전자 주의의무,야간 시야와 감속 의무를 고려하여 운전자 책임을 판단한 사례,횡단보도 인근에서 보행자가 차량에 부딪힌 사안. 이 사건의 핵심 쟁점은 횡단보도 사고와 운전자 주의의무이다. 법원은 관련 자료와 당사자 진술을 종합하여 야간 시야와 감속 의무를 고려하여 운전자 책임을 판단한 사례,
SYN-103,자전거 충돌 사건,교육용 합성법원,2025-07-20,합성2025민사103,교통,자전거도로 통행과 안전거리,추월 방법과 안전거리 확보 여부를 기준으로 과실을 산정한 사례,자전거도로에서 앞 자전거를 추월하다 충돌한 사안. 이 사건의 핵심 쟁점은 자전거도로 통행과 안전거리이다. 법원은 관련 자료와 당사자 진술을 종합하여 추월 방법과 안전거리 확보 여부를 기준으로 과실을 산정한 사례,
SYN-104,렌터카 사고 구상금 사건,교육용 합성법원,2026-08-27,합성2026민사104,교통,대여 차량 사고와 면책 약관,보험 가입 범위와 약관 설명 의무를 기준으로 책임 범위를 판단한 사례,렌터카 이용 중 사고가 발생해 회사가 구상금을 청구한 사안. 이 사건의 핵심 쟁점은 대여 차량 사고와 면책 약관이다. 법원은 관련 자료와 당사자 진술을 종합하여 보험 가입 범위와 약관 설명 의무를 기준으로 책임 범위를 판단한 사례,
SYN-105,킥보드 보행자 충돌 사건,교육용 합성법원,2024-09-07,합성2024민사105,교통,개인형 이동장치 운행 주의의무,운행 장소와 속도를 기준으로 손해배상 책임을 인정한 사례,전동킥보드가 인도에서 보행자와 충돌한 사안. 이 사건의 핵심 쟁점은 개인형 이동장치 운행 주의의무이다. 법원은 관련 자료와 당사자 진술을 종합하여 운행 장소와 속도를 기준으로 손해배상 책임을 인정한 사례,
SYN-106,수술 설명의무 위반 사건,교육용 합성법원,2025-10-14,합성2025민사106,의료,부작용 설명과 자기결정권,대체 치료와 주요 위험 설명 여부를 기준으로 위자료를 인정한 사례,환자가 수술 후 예상치 못한 부작용을 겪은 사안. 이 사건의 핵심 쟁점은 부작용 설명과 자기결정권이다. 법원은 관련 자료와 당사자 진술을 종합하여 대체 치료와 주요 위험 설명 여부를 기준으로 위자료를 인정한 사례,
SYN-107,진단 지연 손해배상 사건,교육용 합성법원,2026-11-21,합성2026민사107,의료,검사 누락과 치료 기회 상실,당시 증상과 의료 수준을 기준으로 과실 여부를 판단한 사례,병원이 추가 검사를 하지 않아 질병 발견이 늦어진 사안. 이 사건의 핵심 쟁점은 검사 누락과 치료 기회 상실이다. 법원은 관련 자료와 당사자 진술을 종합하여 당시 증상과 의료 수준을 기준으로 과실 여부를 판단한 사례,
SYN-108,응급실 전원 지연 사건,교육용 합성법원,2024-12-01,합성2024민사108,의료,응급환자 조치와 의료기관 책임,전원 가능성과 의료진의 조치 시간을 기준으로 판단한 사례,응급환자가 상급병원으로 늦게 전원된 사안. 이 사건의 핵심 쟁점은 응급환자 조치와 의료기관 책임이다. 법원은 관련 자료와 당사자 진술을 종합하여 전원 가능성과 의료진의 조치 시간을 기준으로 판단한 사례,
SYN-109,치과 임플란트 분쟁 사건,교육용 합성법원,2025-01-08,합성2025민사109,의료,시술 실패와 설명의무,시술 전 상태 설명과 사후 관리 의무를 중심으로 판단한 사례,임플란트 시술 후 통증과 재수술이 발생한 사안. 이 사건의 핵심 쟁점은 시술 실패와 설명의무이다. 법원은 관련 자료와 당사자 진술을 종합하여 시술 전 상태 설명과 사후 관리 의무를 중심으로 판단한 사례,
SYN-110,약물 부작용 사건,교육용 합성법원,2026-02-15,합성2026민사110,의료,처방 주의의무와 경고,기왕증 확인과 복약 지도 내용을 기준으로 과실을 판단한 사례,환자가 처방약 복용 후 심한 부작용을 겪은 사안. 이 사건의 핵심 쟁점은 처방 주의의무와 경고이다. 법원은 관련 자료와 당사자 진술을 종합하여 기왕증 확인과 복약 지도 내용을 기준으로 과실을 판단한 사례,
SYN-111,미용시술 손해배상 사건,교육용 합성법원,2024-03-22,합성2024민사111,의료,미용 목적 시술과 결과 보장,시술 위험 설명과 사후 관리의 적정성을 판단한 사례,피부 시술 후 흉터가 남은 사안. 이 사건의 핵심 쟁점은 미용 목적 시술과 결과 보장이다. 법원은 관련 자료와 당사자 진술을 종합하여 시술 위험 설명과 사후 관리의 적정성을 판단한 사례,
SYN-112,보이스피싱 손해배상 사건,교육용 합성법원,2025-04-02,합성2025민사112,금융,금융기관의 이상거래 탐지 의무,거래 패턴과 금융기관의 확인 조치 적정성을 판단한 사례,피해자가 보이스피싱으로 큰 금액을 송금한 사안. 이 사건의 핵심 쟁점은 금융기관의 이상거래 탐지 의무이다. 법원은 관련 자료와 당사자 진술을 종합하여 거래 패턴과 금융기관의 확인 조치 적정성을 판단한 사례,
SYN-113,대출 약정 설명의무 사건,교육용 합성법원,2026-05-09,합성2026민사113,금융,변동금리와 중도상환수수료 설명,계약서 기재와 상담 기록을 근거로 설명의무 이행 여부를 판단한 사례,차주가 대출 조건을 충분히 설명받지 못했다고 주장한 사안. 이 사건의 핵심 쟁점은 변동금리와 중도상환수수료 설명이다. 법원은 관련 자료와 당사자 진술을 종합하여 계약서 기재와 상담 기록을 근거로 설명의무 이행 여부를 판단한 사례,
SYN-114,카드 부정사용 사건,교육용 합성법원,2024-06-16,합성2024민사114,금융,분실 신고 전 사용액 책임,신고 시점과 비밀번호 관리 책임을 기준으로 부담 범위를 정한 사례,신용카드 분실 후 제3자가 결제한 사안. 이 사건의 핵심 쟁점은 분실 신고 전 사용액 책임이다. 법원은 관련 자료와 당사자 진술을 종합하여 신고 시점과 비밀번호 관리 책임을 기준으로 부담 범위를 정한 사례,
SYN-115,투자권유 손해배상 사건,교육용 합성법원,2025-07-23,합성2025민사115,금융,고위험 상품 설명과 적합성 원칙,투자 경험과 위험 설명 자료를 기준으로 금융회사 책임을 판단한 사례,고령 투자자가 고위험 파생상품에 가입한 사안. 이 사건의 핵심 쟁점은 고위험 상품 설명과 적합성 원칙이다. 법원은 관련 자료와 당사자 진술을 종합하여 투자 경험과 위험 설명 자료를 기준으로 금융회사 책임을 판단한 사례,
SYN-116,보험금 지급 거절 사건,교육용 합성법원,2026-08-03,합성2026민사116,금융,고지의무 위반과 인과관계,미고지 사항과 보험사고 사이의 관련성을 판단한 사례,보험사가 과거 병력 미고지를 이유로 보험금 지급을 거절한 사안. 이 사건의 핵심 쟁점은 고지의무 위반과 인과관계이다. 법원은 관련 자료와 당사자 진술을 종합하여 미고지 사항과 보험사고 사이의 관련성을 판단한 사례,
SYN-117,계좌 지급정지 사건,교육용 합성법원,2024-09-10,합성2024민사117,금융,사기 의심 계좌와 권리 구제,거래 경위와 소명 자료를 기준으로 지급정지 유지 필요성을 판단한 사례,계좌가 전기통신금융사기 의심으로 지급정지된 사안. 이 사건의 핵심 쟁점은 사기 의심 계좌와 권리 구제이다. 법원은 관련 자료와 당사자 진술을 종합하여 거래 경위와 소명 자료를 기준으로 지급정지 유지 필요성을 판단한 사례,
SYN-118,상표권 침해 사건,교육용 합성법원,2025-10-17,합성2025민사118,지식재산,유사 상표와 소비자 혼동,"표장의 외관, 호칭, 관념을 종합하여 혼동 가능성을 판단한 사례","비슷한 이름과 로고를 사용한 온라인 판매자가 문제된 사안. 이 사건의 핵심 쟁점은 유사 상표와 소비자 혼동이다. 법원은 관련 자료와 당사자 진술을 종합하여 표장의 외관, 호칭, 관념을 종합하여 혼동 가능성을 판단한 사례",
SYN-119,저작권 침해 사건,교육용 합성법원,2026-11-24,합성2026민사119,지식재산,이미지 무단 사용과 손해액,이용 범위와 통상 사용료를 기준으로 손해액을 산정한 사례,블로그 사진을 허락 없이 쇼핑몰 홍보에 사용한 사안. 이 사건의 핵심 쟁점은 이미지 무단 사용과 손해액이다. 법원은 관련 자료와 당사자 진술을 종합하여 이용 범위와 통상 사용료를 기준으로 손해액을 산정한 사례,
SYN-120,프로그램 소스코드 분쟁 사건,교육용 합성법원,2024-12-04,합성2024민사120,지식재산,외주 개발물의 권리 귀속,계약 문구와 개발 목적을 기준으로 권리 귀속을 판단한 사례,외주 개발자가 납품한 프로그램의 소스코드 제공을 거절한 사안. 이 사건의 핵심 쟁점은 외주 개발물의 권리 귀속이다. 법원은 관련 자료와 당사자 진술을 종합하여 계약 문구와 개발 목적을 기준으로 권리 귀속을 판단한 사례,
SYN-121,영업비밀 유출 사건,교육용 합성법원,2025-01-11,합성2025민사121,지식재산,고객명단 반출과 비밀관리성,접근 제한과 비밀 표시 등 관리 조치를 기준으로 영업비밀성을 판단한 사례,퇴사자가 고객명단을 개인 이메일로 보낸 사안. 이 사건의 핵심 쟁점은 고객명단 반출과 비밀관리성이다. 법원은 관련 자료와 당사자 진술을 종합하여 접근 제한과 비밀 표시 등 관리 조치를 기준으로 영업비밀성을 판단한 사례,
SYN-122,디자인권 침해 사건,교육용 합성법원,2026-02-18,합성2026민사122,지식재산,제품 외관 유사성과 등록디자인,전체적인 심미감과 차이점을 비교하여 침해 여부를 판단한 사례,유사한 형태의 생활용품을 판매한 사안. 이 사건의 핵심 쟁점은 제품 외관 유사성과 등록디자인이다. 법원은 관련 자료와 당사자 진술을 종합하여 전체적인 심미감과 차이점을 비교하여 침해 여부를 판단한 사례,
SYN-123,콘텐츠 라이선스 사건,교육용 합성법원,2024-03-25,합성2024민사123,지식재산,사용 범위 초과와 계약 위반,라이선스 문구와 실제 이용 매체를 기준으로 계약 위반을 인정한 사례,기업이 광고용으로만 허락받은 영상을 다른 채널에도 사용한 사안. 이 사건의 핵심 쟁점은 사용 범위 초과와 계약 위반이다. 법원은 관련 자료와 당사자 진술을 종합하여 라이선스 문구와 실제 이용 매체를 기준으로 계약 위반을 인정한 사례,
SYN-124,양육비 청구 사건,교육용 합성법원,2025-04-05,합성2025민사124,가족,양육비 산정과 소득 자료,부모의 소득과 자녀의 필요비를 기준으로 양육비를 산정한 사례,이혼 후 비양육자가 양육비를 지급하지 않은 사안. 이 사건의 핵심 쟁점은 양육비 산정과 소득 자료이다. 법원은 관련 자료와 당사자 진술을 종합하여 부모의 소득과 자녀의 필요비를 기준으로 양육비를 산정한 사례,
SYN-125,친권자 변경 사건,교육용 합성법원,2026-05-12,합성2026민사125,가족,자녀 복리와 양육 환경,자녀의 안정적 생활과 의사 표현을 고려한 사례,부모 일방이 친권자 변경을 청구한 사안. 이 사건의 핵심 쟁점은 자녀 복리와 양육 환경이다. 법원은 관련 자료와 당사자 진술을 종합하여 자녀의 안정적 생활과 의사 표현을 고려한 사례,
SYN-126,재산분할 사건,교육용 합성법원,2024-06-19,합성2024민사126,가족,혼인 중 형성 재산과 기여도,가사노동과 경제활동 기여를 함께 평가한 사례,이혼 과정에서 부동산과 예금 분할이 다투어진 사안. 이 사건의 핵심 쟁점은 혼인 중 형성 재산과 기여도이다. 법원은 관련 자료와 당사자 진술을 종합하여 가사노동과 경제활동 기여를 함께 평가한 사례,
SYN-127,혼인무효 사건,교육용 합성법원,2025-07-26,합성2025민사127,가족,혼인 의사의 존재,동거 여부와 혼인 생활 의사를 기준으로 판단한 사례,당사자 일방이 형식적으로 혼인신고만 했다고 주장한 사안. 이 사건의 핵심 쟁점은 혼인 의사의 존재이다. 법원은 관련 자료와 당사자 진술을 종합하여 동거 여부와 혼인 생활 의사를 기준으로 판단한 사례,
SYN-128,면접교섭 제한 사건,교육용 합성법원,2026-08-06,합성2026민사128,가족,자녀 안전과 교섭 방식,자녀의 정서적 안정과 보호 필요성을 기준으로 교섭 방식을 정한 사례,면접교섭 과정에서 갈등이 반복된 사안. 이 사건의 핵심 쟁점은 자녀 안전과 교섭 방식이다. 법원은 관련 자료와 당사자 진술을 종합하여 자녀의 정서적 안정과 보호 필요성을 기준으로 교섭 방식을 정한 사례,
SYN-129,주주총회 결의 취소 사건,교육용 합성법원,2024-09-13,합성2024민사129,상사,소집 절차 하자와 결의 효력,절차 하자가 결의 결과에 미친 영향을 판단한 사례,주주에게 소집통지가 제대로 전달되지 않은 사안. 이 사건의 핵심 쟁점은 소집 절차 하자와 결의 효력이다. 법원은 관련 자료와 당사자 진술을 종합하여 절차 하자가 결의 결과에 미친 영향을 판단한 사례,
SYN-130,대표이사 책임 사건,교육용 합성법원,2025-10-20,합성2025민사130,상사,선관주의의무와 회사 손해,의사결정 과정과 사업상 판단 원칙 적용 여부를 판단한 사례,대표이사가 충분한 검토 없이 고액 계약을 체결한 사안. 이 사건의 핵심 쟁점은 선관주의의무와 회사 손해이다. 법원은 관련 자료와 당사자 진술을 종합하여 의사결정 과정과 사업상 판단 원칙 적용 여부를 판단한 사례,
SYN-131,가맹계약 해지 사건,교육용 합성법원,2026-11-27,합성2026민사131,상사,가맹본부의 지원 의무,정보공개서 설명과 교육 지원 이행 여부를 판단한 사례,가맹점주가 매출 부진을 이유로 계약 해지를 다툰 사안. 이 사건의 핵심 쟁점은 가맹본부의 지원 의무이다. 법원은 관련 자료와 당사자 진술을 종합하여 정보공개서 설명과 교육 지원 이행 여부를 판단한 사례,
SYN-132,어음금 청구 사건,교육용 합성법원,2024-12-07,합성2024민사132,상사,배서와 지급 책임,어음 형식 요건과 선의취득 여부를 판단한 사례,배서가 연속되지 않은 어음에 대해 지급을 청구한 사안. 이 사건의 핵심 쟁점은 배서와 지급 책임이다. 법원은 관련 자료와 당사자 진술을 종합하여 어음 형식 요건과 선의취득 여부를 판단한 사례,
SYN-133,동업 정산금 사건,교육용 합성법원,2025-01-14,합성2025민사133,상사,조합 해산과 수익 배분,출자 비율과 실제 비용 부담 자료를 기준으로 정산한 사례,동업자가 사업 종료 후 정산금을 청구한 사안. 이 사건의 핵심 쟁점은 조합 해산과 수익 배분이다. 법원은 관련 자료와 당사자 진술을 종합하여 출자 비율과 실제 비용 부담 자료를 기준으로 정산한 사례,
SYN-134,하도급 대금 사건,교육용 합성법원,2026-02-21,합성2026민사134,상사,원사업자의 대금 감액,하자 입증과 감액 절차 준수 여부를 판단한 사례,원사업자가 품질 문제를 이유로 하도급대금을 감액한 사안. 이 사건의 핵심 쟁점은 원사업자의 대금 감액이다. 법원은 관련 자료와 당사자 진술을 종합하여 하자 입증과 감액 절차 준수 여부를 판단한 사례,
SYN-135,회원정보 유출 사건,교육용 합성법원,2024-03-01,합성2024민사135,개인정보,보안 조치와 손해배상,암호화와 접근통제 등 안전조치 이행 여부를 판단한 사례,웹사이트 해킹으로 회원정보가 유출된 사안. 이 사건의 핵심 쟁점은 보안 조치와 손해배상이다. 법원은 관련 자료와 당사자 진술을 종합하여 암호화와 접근통제 등 안전조치 이행 여부를 판단한 사례,
SYN-136,CCTV 열람 거부 사건,교육용 합성법원,2025-04-08,합성2025민사136,개인정보,정보주체의 열람권과 제3자 보호,제3자 영상 마스킹 가능성과 열람 필요성을 비교한 사례,입주민이 본인이 나온 CCTV 영상 열람을 요구한 사안. 이 사건의 핵심 쟁점은 정보주체의 열람권과 제3자 보호이다. 법원은 관련 자료와 당사자 진술을 종합하여 제3자 영상 마스킹 가능성과 열람 필요성을 비교한 사례,
SYN-137,마케팅 문자 발송 사건,교육용 합성법원,2026-05-15,합성2026민사137,개인정보,동의 없는 광고성 정보 전송,수신 동의와 철회 절차 고지 여부를 기준으로 위법성을 판단한 사례,업체가 회원에게 광고 문자를 반복 발송한 사안. 이 사건의 핵심 쟁점은 동의 없는 광고성 정보 전송이다. 법원은 관련 자료와 당사자 진술을 종합하여 수신 동의와 철회 절차 고지 여부를 기준으로 위법성을 판단한 사례,
SYN-138,채용 개인정보 보관 사건,교육용 합성법원,2024-06-22,합성2024민사138,개인정보,불합격자 정보 보유 기간,보유 목적 소멸과 파기 의무 이행 여부를 판단한 사례,회사가 채용 절차 종료 후에도 지원자 정보를 보관한 사안. 이 사건의 핵심 쟁점은 불합격자 정보 보유 기간이다. 법원은 관련 자료와 당사자 진술을 종합하여 보유 목적 소멸과 파기 의무 이행 여부를 판단한 사례,
SYN-139,병원 개인정보 조회 사건,교육용 합성법원,2025-07-02,합성2025민사139,개인정보,직원의 무단 조회와 관리 책임,접근권한 관리와 로그 점검 조치의 적정성을 판단한 사례,병원 직원이 지인 진료기록을 조회한 사안. 이 사건의 핵심 쟁점은 직원의 무단 조회와 관리 책임이다. 법원은 관련 자료와 당사자 진술을 종합하여 접근권한 관리와 로그 점검 조치의 적정성을 판단한 사례,
SYN-140,위치정보 수집 사건,교육용 합성법원,2026-08-09,합성2026민사140,개인정보,앱 위치정보 동의와 이용 범위,동의 문구의 구체성과 최소수집 원칙을 기준으로 판단한 사례,모바일 앱이 서비스와 무관한 위치정보를 수집한 사안. 이 사건의 핵심 쟁점은 앱 위치정보 동의와 이용 범위이다. 법원은 관련 자료와 당사자 진술을 종합하여 동의 문구의 구체성과 최소수집 원칙을 기준으로 판단한 사례,
SYN-141,건설현장 추락 사고 사건,교육용 합성법원,2024-09-16,합성2024민사141,산업재해,안전난간 미설치와 산재 책임,안전시설 설치 여부와 보호구 지급 상황을 기준으로 책임을 판단한 사례,건설근로자가 작업 중 추락한 사안. 이 사건의 핵심 쟁점은 안전난간 미설치와 산재 책임이다. 법원은 관련 자료와 당사자 진술을 종합하여 안전시설 설치 여부와 보호구 지급 상황을 기준으로 책임을 판단한 사례,
SYN-142,과로사 산재 인정 사건,교육용 합성법원,2025-10-23,합성2025민사142,산업재해,장시간 근로와 업무상 재해,근로시간 증가와 업무 스트레스를 기준으로 업무상 재해를 인정한 사례,근로자가 장기간 야근 후 심혈관 질환으로 사망한 사안. 이 사건의 핵심 쟁점은 장시간 근로와 업무상 재해이다. 법원은 관련 자료와 당사자 진술을 종합하여 근로시간 증가와 업무 스트레스를 기준으로 업무상 재해를 인정한 사례,
SYN-143,배달 사고 산재 사건,교육용 합성법원,2026-11-03,합성2026민사143,산업재해,플랫폼 업무와 재해 인정,업무 수행 중 사고인지와 플랫폼 지시 정도를 고려한 사례,배달원이 배달 중 교통사고를 당한 사안. 이 사건의 핵심 쟁점은 플랫폼 업무와 재해 인정이다. 법원은 관련 자료와 당사자 진술을 종합하여 업무 수행 중 사고인지와 플랫폼 지시 정도를 고려한 사례,
SYN-144,감정노동 산재 사건,교육용 합성법원,2024-12-10,합성2024민사144,산업재해,고객 폭언과 정신질환,업무상 스트레스와 의학적 인과관계를 중심으로 판단한 사례,상담원이 반복적인 고객 폭언 후 우울 증상을 호소한 사안. 이 사건의 핵심 쟁점은 고객 폭언과 정신질환이다. 법원은 관련 자료와 당사자 진술을 종합하여 업무상 스트레스와 의학적 인과관계를 중심으로 판단한 사례,
SYN-145,기계 끼임 사고 사건,교육용 합성법원,2025-01-17,합성2025민사145,산업재해,안전장치 제거와 사용자 책임,안전장치 유지와 작업 교육 이행 여부를 기준으로 판단한 사례,공장 작업자가 기계에 손을 다친 사안. 이 사건의 핵심 쟁점은 안전장치 제거와 사용자 책임이다. 법원은 관련 자료와 당사자 진술을 종합하여 안전장치 유지와 작업 교육 이행 여부를 기준으로 판단한 사례,
SYN-146,출퇴근 재해 사건,교육용 합성법원,2026-02-24,합성2026민사146,산업재해,통상 경로와 일탈 여부,통상적인 출퇴근 경로와 사적 일탈 여부를 기준으로 산재 인정 여부를 판단한 사례,근로자가 출근 중 사고를 당한 사안. 이 사건의 핵심 쟁점은 통상 경로와 일탈 여부이다. 법원은 관련 자료와 당사자 진술을 종합하여 통상적인 출퇴근 경로와 사적 일탈 여부를 기준으로 산재 인정 여부를 판단한 사례,
SYN-147,클라우드 장애 손해배상 사건,교육용 합성법원,2024-03-04,합성2024민사147,IT서비스,서비스 장애와 면책 조항,장애 시간과 약관상 책임 제한 조항의 효력을 판단한 사례,클라우드 서비스 장애로 쇼핑몰 운영이 중단된 사안. 이 사건의 핵심 쟁점은 서비스 장애와 면책 조항이다. 법원은 관련 자료와 당사자 진술을 종합하여 장애 시간과 약관상 책임 제한 조항의 효력을 판단한 사례,
SYN-148,앱 결제 오류 환불 사건,교육용 합성법원,2025-04-11,합성2025민사148,IT서비스,중복 결제와 사업자 반환 의무,결제 로그와 환불 처리 지연을 기준으로 반환 책임을 인정한 사례,모바일 앱에서 같은 상품이 두 번 결제된 사안. 이 사건의 핵심 쟁점은 중복 결제와 사업자 반환 의무이다. 법원은 관련 자료와 당사자 진술을 종합하여 결제 로그와 환불 처리 지연을 기준으로 반환 책임을 인정한 사례,
SYN-149,게임 계정 정지 사건,교육용 합성법원,2026-05-18,합성2026민사149,IT서비스,운영정책 위반과 제재 절차,운영정책 고지와 이용자의 소명 기회 제공 여부를 판단한 사례,게임사가 비정상 이용을 이유로 계정을 정지한 사안. 이 사건의 핵심 쟁점은 운영정책 위반과 제재 절차이다. 법원은 관련 자료와 당사자 진술을 종합하여 운영정책 고지와 이용자의 소명 기회 제공 여부를 판단한 사례,
SYN-150,플랫폼 리뷰 삭제 사건,교육용 합성법원,2024-06-25,합성2024민사150,IT서비스,리뷰 정책과 표현의 자유,허위 여부와 플랫폼 정책 적용의 일관성을 기준으로 판단한 사례,플랫폼이 부정적 후기를 삭제한 사안. 이 사건의 핵심 쟁점은 리뷰 정책과 표현의 자유이다. 법원은 관련 자료와 당사자 진술을 종합하여 허위 여부와 플랫폼 정책 적용의 일관성을 기준으로 판단한 사례,
SYN-151,구독 서비스 자동결제 사건,교육용 합성법원,2025-07-05,합성2025민사151,IT서비스,갱신 고지와 해지 절차,갱신 고지의 명확성과 해지 접근성을 기준으로 환불 여부를 판단한 사례,무료 체험 후 자동결제가 이루어진 사안. 이 사건의 핵심 쟁점은 갱신 고지와 해지 절차이다. 법원은 관련 자료와 당사자 진술을 종합하여 갱신 고지의 명확성과 해지 접근성을 기준으로 환불 여부를 판단한 사례,
