id,case_name,court,decision_date,case_number,category,issues,summary,text,source_url
SYN-051,길거리 시비 폭행 사건,교육용 합성법원,2025-04-02,합성2025데모051,형사,단순폭행과 정당방위 주장,길거리에서 시비가 붙은 뒤 상대방을 먼저 때린 행위에 대해 정당방위를 부정하고 폭행 책임을 인정한 사례,피고인은 길거리에서 말다툼을 하던 중 상대방의 어깨를 밀치고 얼굴을 때렸다. 상대방이 먼저 욕설을 했다는 사정만으로 물리적 공격이 정당화되지는 않아 폭행죄가 인정되었다.,
SYN-052,행인 폭행 치료비 손해배상 사건,교육용 합성법원,2024-05-03,합성2024데모052,민사,불법행위와 치료비 및 위자료,가해자가 지나가던 행인을 폭행해 다치게 한 경우 치료비와 위자료 배상 책임을 인정한 사례,"피고는 별다른 이유 없이 지나가던 행인을 밀어 넘어뜨리고 주먹으로 폭행하였다. 피해자는 병원 치료를 받았고 법원은 치료비, 일실수입 일부, 정신적 손해에 대한 위자료를 인정하였다.",
SYN-053,편의점 앞 폭행 합의 사건,교육용 합성법원,2025-06-04,합성2025데모053,형사,상해 정도와 양형,피해자와 합의했더라도 폭행으로 상해가 발생한 경우 범행 경위와 피해 정도를 고려해 처벌한 사례,피고인은 편의점 앞에서 피해자와 눈이 마주쳤다는 이유로 시비를 걸고 폭행하였다. 피해자가 전치 2주의 상해를 입었고 합의가 있었지만 폭력 전력이 양형에 고려되었다.,
SYN-054,대여금 반환 청구 사건,교육용 합성법원,2024-06-01,합성2024민사054,민사,차용증 없는 금전 대여와 변제 책임,반복 송금 내역과 변제 약속 메시지를 근거로 금전 소비대차 관계를 인정한 사례,친구에게 송금한 돈이 투자금인지 대여금인지 다툰 사건. 이 사건의 핵심 쟁점은 차용증 없는 금전 대여와 변제 책임이다. 법원은 관련 자료와 당사자 진술을 종합하여 반복 송금 내역과 변제 약속 메시지를 근거로 금전 소비대차 관계를 인정한 사례,
SYN-055,공사대금 미지급 사건,교육용 합성법원,2025-07-08,합성2025민사055,민사,추가 공사 범위와 대금 지급 의무,견적서와 현장 확인 자료를 통해 추가 공사의 합의와 대금 상당액을 판단한 사례,인테리어 공사 후 추가 공사비 지급을 거절한 사안. 이 사건의 핵심 쟁점은 추가 공사 범위와 대금 지급 의무이다. 법원은 관련 자료와 당사자 진술을 종합하여 견적서와 현장 확인 자료를 통해 추가 공사의 합의와 대금 상당액을 판단한 사례,
SYN-056,위자료 청구 사건,교육용 합성법원,2026-08-15,합성2026민사056,민사,모욕적 발언과 정신적 손해,발언 경위와 전파 가능성을 고려하여 위자료 일부를 인정한 사례,직장 내 공개 회의에서 모욕적 발언이 반복된 사안. 이 사건의 핵심 쟁점은 모욕적 발언과 정신적 손해이다. 법원은 관련 자료와 당사자 진술을 종합하여 발언 경위와 전파 가능성을 고려하여 위자료 일부를 인정한 사례,
SYN-057,손해배상 예정액 감액 사건,교육용 합성법원,2024-09-22,합성2024민사057,민사,계약 위반과 과도한 위약금,실제 손해와 계약 체결 경위를 고려하여 손해배상 예정액을 감액한 사례,납품 지연을 이유로 높은 위약금을 청구한 사안. 이 사건의 핵심 쟁점은 계약 위반과 과도한 위약금이다. 법원은 관련 자료와 당사자 진술을 종합하여 실제 손해와 계약 체결 경위를 고려하여 손해배상 예정액을 감액한 사례,
SYN-058,부당이득 반환 사건,교육용 합성법원,2025-10-02,합성2025민사058,민사,착오 송금과 반환 의무,수취인이 법률상 원인 없이 이익을 얻었다고 보아 반환 의무를 인정한 사례,계좌번호 착오로 타인에게 돈이 이체된 사안. 이 사건의 핵심 쟁점은 착오 송금과 반환 의무이다. 법원은 관련 자료와 당사자 진술을 종합하여 수취인이 법률상 원인 없이 이익을 얻었다고 보아 반환 의무를 인정한 사례,
SYN-059,채무불이행 손해배상 사건,교육용 합성법원,2026-11-09,합성2026민사059,민사,납품 물품 하자와 계약상 책임,하자 통지 시점과 손해 확대 방지 노력을 함께 고려한 사례,주문한 기계가 규격에 맞지 않아 영업 손실이 발생한 사안. 이 사건의 핵심 쟁점은 납품 물품 하자와 계약상 책임이다. 법원은 관련 자료와 당사자 진술을 종합하여 하자 통지 시점과 손해 확대 방지 노력을 함께 고려한 사례,
SYN-060,명의대여 책임 사건,교육용 합성법원,2024-12-16,합성2024민사060,민사,명의 사용 허락과 거래상 책임,명의대여자의 외관 형성 기여와 거래 상대방의 신뢰를 판단한 사례,가족에게 사업자 명의를 빌려준 뒤 거래 채무가 발생한 사안. 이 사건의 핵심 쟁점은 명의 사용 허락과 거래상 책임이다. 법원은 관련 자료와 당사자 진술을 종합하여 명의대여자의 외관 형성 기여와 거래 상대방의 신뢰를 판단한 사례,
SYN-061,불법행위 손해배상 사건,교육용 합성법원,2025-01-23,합성2025민사061,민사,폭행 후 치료비와 위자료,치료 기간과 폭행 경위를 기준으로 치료비 및 위자료를 산정한 사례,길거리 폭행으로 상해를 입은 피해자가 민사상 배상을 청구한 사안. 이 사건의 핵심 쟁점은 폭행 후 치료비와 위자료이다. 법원은 관련 자료와 당사자 진술을 종합하여 치료 기간과 폭행 경위를 기준으로 치료비 및 위자료를 산정한 사례,
SYN-062,행인 폭행 상해 사건,교육용 합성법원,2026-02-03,합성2026형사062,형사,우발적 폭행과 상해 고의,상해 진단서와 목격자 진술을 근거로 폭행과 상해의 고의를 판단한 사례,피고인이 지나가는 행인과 시비가 붙어 얼굴을 때린 사안. 이 사건의 핵심 쟁점은 우발적 폭행과 상해 고의이다. 법원은 관련 자료와 당사자 진술을 종합하여 상해 진단서와 목격자 진술을 근거로 폭행과 상해의 고의를 판단한 사례,
SYN-063,술자리 특수폭행 사건,교육용 합성법원,2024-03-10,합성2024형사063,형사,위험한 물건 사용과 특수폭행,물건의 성질과 사용 태양을 기준으로 위험한 물건 해당성을 판단한 사례,술자리 다툼 중 병을 들고 상대방을 위협한 사안. 이 사건의 핵심 쟁점은 위험한 물건 사용과 특수폭행이다. 법원은 관련 자료와 당사자 진술을 종합하여 물건의 성질과 사용 태양을 기준으로 위험한 물건 해당성을 판단한 사례,
SYN-064,무면허 운전 사건,교육용 합성법원,2025-04-17,합성2025형사064,형사,반복 무면허 운전과 양형,"동종 전력과 운전 거리, 재범 위험성을 고려하여 형을 정한 사례","면허 취소 후에도 차량을 운전하다 적발된 사안. 이 사건의 핵심 쟁점은 반복 무면허 운전과 양형이다. 법원은 관련 자료와 당사자 진술을 종합하여 동종 전력과 운전 거리, 재범 위험성을 고려하여 형을 정한 사례",
SYN-065,업무상횡령 사건,교육용 합성법원,2026-05-24,합성2026형사065,형사,회사 자금 개인 사용,자금 인출 내역과 사용처를 근거로 불법영득의사를 인정한 사례,직원이 회사 계좌에서 개인 카드대금을 결제한 사안. 이 사건의 핵심 쟁점은 회사 자금 개인 사용이다. 법원은 관련 자료와 당사자 진술을 종합하여 자금 인출 내역과 사용처를 근거로 불법영득의사를 인정한 사례,
SYN-066,주거침입 사건,교육용 합성법원,2024-06-04,합성2024형사066,형사,공동현관 출입과 침입 고의,출입 목적과 거주자의 평온 침해 여부를 중심으로 판단한 사례,허락 없이 공동주택 현관을 지나 세대 앞까지 간 사안. 이 사건의 핵심 쟁점은 공동현관 출입과 침입 고의이다. 법원은 관련 자료와 당사자 진술을 종합하여 출입 목적과 거주자의 평온 침해 여부를 중심으로 판단한 사례,
SYN-067,명예훼손 사건,교육용 합성법원,2025-07-11,합성2025형사067,형사,온라인 게시글과 공익성,사실 적시 여부와 공공의 이익 목적을 비교한 사례,인터넷 게시판에 특정인을 비난하는 글을 올린 사안. 이 사건의 핵심 쟁점은 온라인 게시글과 공익성이다. 법원은 관련 자료와 당사자 진술을 종합하여 사실 적시 여부와 공공의 이익 목적을 비교한 사례,
SYN-068,협박 메시지 사건,교육용 합성법원,2026-08-18,합성2026형사068,형사,공포심 유발과 협박죄 성립,문구의 내용과 발송 횟수를 고려하여 협박의 정도를 판단한 사례,채무 변제를 요구하며 반복적으로 위협 문자를 보낸 사안. 이 사건의 핵심 쟁점은 공포심 유발과 협박죄 성립이다. 법원은 관련 자료와 당사자 진술을 종합하여 문구의 내용과 발송 횟수를 고려하여 협박의 정도를 판단한 사례,
SYN-069,절도 사건,교육용 합성법원,2024-09-25,합성2024형사069,형사,점유 이탈물과 절도 고의,물건의 점유 상태와 반환 의사 유무를 기준으로 절도 고의를 판단한 사례,카페 테이블 위 휴대전화를 가져간 사안. 이 사건의 핵심 쟁점은 점유 이탈물과 절도 고의이다. 법원은 관련 자료와 당사자 진술을 종합하여 물건의 점유 상태와 반환 의사 유무를 기준으로 절도 고의를 판단한 사례,
SYN-070,스토킹처벌법 위반 사건,교육용 합성법원,2025-10-05,합성2025형사070,형사,반복 연락과 불안감 조성,연락 빈도와 피해자의 거부 의사를 기준으로 스토킹 행위를 인정한 사례,이별 후 상대방에게 지속적으로 연락하고 찾아간 사안. 이 사건의 핵심 쟁점은 반복 연락과 불안감 조성이다. 법원은 관련 자료와 당사자 진술을 종합하여 연락 빈도와 피해자의 거부 의사를 기준으로 스토킹 행위를 인정한 사례,
SYN-071,전세보증금 반환 사건,교육용 합성법원,2026-11-12,합성2026민사071,부동산,임대차 종료와 보증금 반환,목적물 인도와 보증금 반환 의무의 동시이행 관계를 판단한 사례,임차인이 계약 종료 후 이사했지만 보증금을 돌려받지 못한 사안. 이 사건의 핵심 쟁점은 임대차 종료와 보증금 반환이다. 법원은 관련 자료와 당사자 진술을 종합하여 목적물 인도와 보증금 반환 의무의 동시이행 관계를 판단한 사례,
SYN-072,누수 손해배상 사건,교육용 합성법원,2024-12-19,합성2024민사072,부동산,층간 누수와 수리비 부담,누수 원인과 관리 책임을 기준으로 손해배상 책임을 인정한 사례,윗집 배관 누수로 아래층 천장이 손상된 사안. 이 사건의 핵심 쟁점은 층간 누수와 수리비 부담이다. 법원은 관련 자료와 당사자 진술을 종합하여 누수 원인과 관리 책임을 기준으로 손해배상 책임을 인정한 사례,
SYN-073,부동산 중개수수료 사건,교육용 합성법원,2025-01-26,합성2025민사073,부동산,중개 완성과 보수 청구,중개 행위가 계약 성립에 실질적으로 기여했는지 판단한 사례,계약 직전 거래 당사자가 직접 계약을 체결한 사안. 이 사건의 핵심 쟁점은 중개 완성과 보수 청구이다. 법원은 관련 자료와 당사자 진술을 종합하여 중개 행위가 계약 성립에 실질적으로 기여했는지 판단한 사례,
SYN-074,매매계약 해제 사건,교육용 합성법원,2026-02-06,합성2026민사074,부동산,잔금 미지급과 계약 해제,최고 절차와 이행 지체 기간을 기준으로 해제 효력을 판단한 사례,매수인이 잔금일에 대금을 지급하지 못한 사안. 이 사건의 핵심 쟁점은 잔금 미지급과 계약 해제이다. 법원은 관련 자료와 당사자 진술을 종합하여 최고 절차와 이행 지체 기간을 기준으로 해제 효력을 판단한 사례,
SYN-075,권리금 회수 방해 사건,교육용 합성법원,2024-03-13,합성2024민사075,부동산,상가 임대인의 신규 임차인 거절,권리금 회수 기회 보호 의무 위반 여부를 판단한 사례,임대인이 정당한 이유 없이 신규 임차인과 계약을 거절한 사안. 이 사건의 핵심 쟁점은 상가 임대인의 신규 임차인 거절이다. 법원은 관련 자료와 당사자 진술을 종합하여 권리금 회수 기회 보호 의무 위반 여부를 판단한 사례,
SYN-076,공유물 분할 사건,교육용 합성법원,2025-04-20,합성2025민사076,부동산,공유 부동산의 현물분할 가능성,토지 이용 현황과 경제적 가치 감소를 고려하여 분할 방법을 정한 사례,상속받은 토지를 공유자들이 나누지 못한 사안. 이 사건의 핵심 쟁점은 공유 부동산의 현물분할 가능성이다. 법원은 관련 자료와 당사자 진술을 종합하여 토지 이용 현황과 경제적 가치 감소를 고려하여 분할 방법을 정한 사례,
SYN-077,불법 증축 철거 사건,교육용 합성법원,2026-05-27,합성2026민사077,부동산,무단 증축과 원상회복,계약상 원상회복 조항과 변경 정도를 기준으로 철거 의무를 인정한 사례,임차인이 허락 없이 점포 구조를 변경한 사안. 이 사건의 핵심 쟁점은 무단 증축과 원상회복이다. 법원은 관련 자료와 당사자 진술을 종합하여 계약상 원상회복 조항과 변경 정도를 기준으로 철거 의무를 인정한 사례,
SYN-078,임대차 차임 감액 사건,교육용 합성법원,2024-06-07,합성2024민사078,부동산,상권 변화와 차임 조정,경제 사정 변경과 계약 유지 가능성을 종합해 판단한 사례,주변 공사로 매출이 급감하자 차임 감액을 청구한 사안. 이 사건의 핵심 쟁점은 상권 변화와 차임 조정이다. 법원은 관련 자료와 당사자 진술을 종합하여 경제 사정 변경과 계약 유지 가능성을 종합해 판단한 사례,
SYN-079,정보공개 거부 처분 사건,교육용 합성법원,2025-07-14,합성2025민사079,행정,공공기관 문서와 비공개 사유,국민의 알 권리와 의사결정 과정 보호 필요성을 비교한 사례,민원인이 행정 내부 검토 문서 공개를 청구한 사안. 이 사건의 핵심 쟁점은 공공기관 문서와 비공개 사유이다. 법원은 관련 자료와 당사자 진술을 종합하여 국민의 알 권리와 의사결정 과정 보호 필요성을 비교한 사례,
SYN-080,운전면허 취소 사건,교육용 합성법원,2026-08-21,합성2026민사080,행정,음주운전과 생계 사정,혈중알코올농도와 직업상 불이익을 함께 고려한 사례,운전업 종사자가 음주운전으로 면허 취소 처분을 받은 사안. 이 사건의 핵심 쟁점은 음주운전과 생계 사정이다. 법원은 관련 자료와 당사자 진술을 종합하여 혈중알코올농도와 직업상 불이익을 함께 고려한 사례,
SYN-081,과징금 부과 처분 사건,교육용 합성법원,2024-09-01,합성2024민사081,행정,법 위반 정도와 과징금 산정,매출액 산정과 위반 기간을 기준으로 처분 적법성을 판단한 사례,사업자가 표시광고 기준을 위반해 과징금을 부과받은 사안. 이 사건의 핵심 쟁점은 법 위반 정도와 과징금 산정이다. 법원은 관련 자료와 당사자 진술을 종합하여 매출액 산정과 위반 기간을 기준으로 처분 적법성을 판단한 사례,
SYN-082,건축허가 반려 사건,교육용 합성법원,2025-10-08,합성2025민사082,행정,인접 토지 통행권과 허가 요건,관련 법령상 도로 접속 요건 충족 여부를 판단한 사례,진입로 확보가 부족하다는 이유로 건축허가가 반려된 사안. 이 사건의 핵심 쟁점은 인접 토지 통행권과 허가 요건이다. 법원은 관련 자료와 당사자 진술을 종합하여 관련 법령상 도로 접속 요건 충족 여부를 판단한 사례,
SYN-083,공무원 징계 처분 사건,교육용 합성법원,2026-11-15,합성2026민사083,행정,비위 정도와 징계 양정,비위 동기와 개인정보 침해 정도를 고려한 사례,공무원이 개인정보를 사적으로 조회해 징계를 받은 사안. 이 사건의 핵심 쟁점은 비위 정도와 징계 양정이다. 법원은 관련 자료와 당사자 진술을 종합하여 비위 동기와 개인정보 침해 정도를 고려한 사례,
SYN-084,사회복지급여 환수 사건,교육용 합성법원,2024-12-22,합성2024민사084,행정,소득 신고 누락과 환수 범위,고의성 여부와 환수 금액 산정의 적정성을 판단한 사례,수급자가 소득 변동을 신고하지 않아 급여 환수 처분을 받은 사안. 이 사건의 핵심 쟁점은 소득 신고 누락과 환수 범위이다. 법원은 관련 자료와 당사자 진술을 종합하여 고의성 여부와 환수 금액 산정의 적정성을 판단한 사례,
SYN-085,학교폭력 처분 사건,교육용 합성법원,2025-01-02,합성2025민사085,행정,가해학생 조치와 절차 보장,조사 절차와 피해 회복 조치를 기준으로 처분 적법성을 판단한 사례,학생에게 출석정지 조치가 내려진 사안. 이 사건의 핵심 쟁점은 가해학생 조치와 절차 보장이다. 법원은 관련 자료와 당사자 진술을 종합하여 조사 절차와 피해 회복 조치를 기준으로 처분 적법성을 판단한 사례,
SYN-086,임금 체불 사건,교육용 합성법원,2026-02-09,합성2026민사086,노동,연장근로수당과 근로시간,출퇴근 기록과 업무 메신저 자료를 근거로 연장근로를 인정한 사례,회사가 야근 수당을 지급하지 않은 사안. 이 사건의 핵심 쟁점은 연장근로수당과 근로시간이다. 법원은 관련 자료와 당사자 진술을 종합하여 출퇴근 기록과 업무 메신저 자료를 근거로 연장근로를 인정한 사례,
SYN-087,프리랜서 근로자성 사건,교육용 합성법원,2024-03-16,합성2024민사087,노동,업무 지휘 감독과 근로자성,업무 지시와 보수 지급 방식을 종합하여 근로자성을 판단한 사례,계약서상 프리랜서가 실제로 정해진 시간에 근무한 사안. 이 사건의 핵심 쟁점은 업무 지휘 감독과 근로자성이다. 법원은 관련 자료와 당사자 진술을 종합하여 업무 지시와 보수 지급 방식을 종합하여 근로자성을 판단한 사례,
SYN-088,직장 내 괴롭힘 사건,교육용 합성법원,2025-04-23,합성2025민사088,노동,반복적 모욕과 사용자 조치,사용자의 조사와 보호 조치가 충분했는지 판단한 사례,상사가 회의에서 반복적으로 직원을 모욕한 사안. 이 사건의 핵심 쟁점은 반복적 모욕과 사용자 조치이다. 법원은 관련 자료와 당사자 진술을 종합하여 사용자의 조사와 보호 조치가 충분했는지 판단한 사례,
SYN-089,퇴직금 청구 사건,교육용 합성법원,2026-05-03,합성2026민사089,노동,계속근로기간과 퇴직금,계약 갱신 경위와 업무 연속성을 기준으로 계속근로기간을 인정한 사례,단기 계약을 반복 갱신한 근로자가 퇴직금을 청구한 사안. 이 사건의 핵심 쟁점은 계속근로기간과 퇴직금이다. 법원은 관련 자료와 당사자 진술을 종합하여 계약 갱신 경위와 업무 연속성을 기준으로 계속근로기간을 인정한 사례,
SYN-090,전보명령 무효 사건,교육용 합성법원,2024-06-10,합성2024민사090,노동,업무상 필요와 생활상 불이익,회사의 인사 필요성과 근로자의 생활상 불이익을 비교한 사례,근로자가 먼 지역으로 전보된 사안. 이 사건의 핵심 쟁점은 업무상 필요와 생활상 불이익이다. 법원은 관련 자료와 당사자 진술을 종합하여 회사의 인사 필요성과 근로자의 생활상 불이익을 비교한 사례,
SYN-091,산재 불이익 처분 사건,교육용 합성법원,2025-07-17,합성2025민사091,노동,산재 신청 후 평가 불이익,평가 기준의 객관성과 불이익 취급 여부를 판단한 사례,근로자가 산업재해 신청 후 낮은 인사평가를 받은 사안. 이 사건의 핵심 쟁점은 산재 신청 후 평가 불이익이다. 법원은 관련 자료와 당사자 진술을 종합하여 평가 기준의 객관성과 불이익 취급 여부를 판단한 사례,
SYN-092,채용 취소 사건,교육용 합성법원,2026-08-24,합성2026민사092,노동,경력 기재 오류와 신뢰 관계,오류의 중대성과 채용 결정에 미친 영향을 판단한 사례,합격자가 경력 기간을 잘못 기재해 채용이 취소된 사안. 이 사건의 핵심 쟁점은 경력 기재 오류와 신뢰 관계이다. 법원은 관련 자료와 당사자 진술을 종합하여 오류의 중대성과 채용 결정에 미친 영향을 판단한 사례,
SYN-093,중고차 사고이력 고지 사건,교육용 합성법원,2024-09-04,합성2024민사093,소비자,무사고 설명과 계약 취소,사고 이력이 거래 가격과 구매 결정에 중요한 정보라고 본 사례,중고차를 무사고 차량으로 설명받고 구매했으나 사고 이력이 발견된 사안. 이 사건의 핵심 쟁점은 무사고 설명과 계약 취소이다. 법원은 관련 자료와 당사자 진술을 종합하여 사고 이력이 거래 가격과 구매 결정에 중요한 정보라고 본 사례,
SYN-094,온라인 쇼핑몰 환불 사건,교육용 합성법원,2025-10-11,합성2025민사094,소비자,하자 상품과 청약철회,초기 하자와 판매자의 교환 지연을 이유로 환불 의무를 인정한 사례,온라인으로 산 전자제품이 작동하지 않아 환불을 요구한 사안. 이 사건의 핵심 쟁점은 하자 상품과 청약철회이다. 법원은 관련 자료와 당사자 진술을 종합하여 초기 하자와 판매자의 교환 지연을 이유로 환불 의무를 인정한 사례,
SYN-095,헬스장 이용권 환불 사건,교육용 합성법원,2026-11-18,합성2026민사095,소비자,중도 해지와 위약금 제한,잔여 기간과 약관상 위약금 조항의 공정성을 판단한 사례,장기 회원권을 결제한 뒤 개인 사정으로 해지를 요청한 사안. 이 사건의 핵심 쟁점은 중도 해지와 위약금 제한이다. 법원은 관련 자료와 당사자 진술을 종합하여 잔여 기간과 약관상 위약금 조항의 공정성을 판단한 사례,
SYN-096,항공권 취소 수수료 사건,교육용 합성법원,2024-12-25,합성2024민사096,소비자,천재지변과 환불 수수료,운항 가능성과 소비자 책임 없는 취소 사유를 기준으로 판단한 사례,태풍으로 항공편 이용이 어려워진 사안. 이 사건의 핵심 쟁점은 천재지변과 환불 수수료이다. 법원은 관련 자료와 당사자 진술을 종합하여 운항 가능성과 소비자 책임 없는 취소 사유를 기준으로 판단한 사례,
SYN-097,숙박 예약 환불 사건,교육용 합성법원,2025-01-05,합성2025민사097,소비자,예약 취소와 과도한 위약금,사업자의 실제 손해와 약관상 취소 규정을 비교한 사례,숙박 예정일 상당 기간 전에 예약을 취소한 사안. 이 사건의 핵심 쟁점은 예약 취소와 과도한 위약금이다. 법원은 관련 자료와 당사자 진술을 종합하여 사업자의 실제 손해와 약관상 취소 규정을 비교한 사례,
SYN-098,통신요금 부당 청구 사건,교육용 합성법원,2026-02-12,합성2026민사098,소비자,부가서비스 미고지와 요금 반환,고지와 동의 절차가 부족했다고 보아 요금 반환을 인정한 사례,이용자가 가입 사실을 모르는 부가서비스 요금을 낸 사안. 이 사건의 핵심 쟁점은 부가서비스 미고지와 요금 반환이다. 법원은 관련 자료와 당사자 진술을 종합하여 고지와 동의 절차가 부족했다고 보아 요금 반환을 인정한 사례,
SYN-099,가전제품 품질보증 사건,교육용 합성법원,2024-03-19,합성2024민사099,소비자,보증기간 내 반복 고장,수리 횟수와 사용상 불편 정도를 기준으로 교환 또는 환불 필요성을 판단한 사례,냉장고가 보증기간 내 반복적으로 고장난 사안. 이 사건의 핵심 쟁점은 보증기간 내 반복 고장이다. 법원은 관련 자료와 당사자 진술을 종합하여 수리 횟수와 사용상 불편 정도를 기준으로 교환 또는 환불 필요성을 판단한 사례,
SYN-100,학원 수강료 환불 사건,교육용 합성법원,2025-04-26,합성2025민사100,소비자,강의 미수강과 환불 기준,수강 기간과 제공된 강의 횟수를 기준으로 환불액을 산정한 사례,수강생이 개강 직후 계약 해지를 요청한 사안. 이 사건의 핵심 쟁점은 강의 미수강과 환불 기준이다. 법원은 관련 자료와 당사자 진술을 종합하여 수강 기간과 제공된 강의 횟수를 기준으로 환불액을 산정한 사례,
